{
  "$schema": "../scenario.schema.json",
  "name": "Two regulars",
  "description": "Two people, Alex and Sam, visit the same three characters. Alex brings Mina a ring while Yuna watches. Yuna's jealousy is about Alex, so that is who Yuna writes to; Haru hears the story and asks Alex about it; when Alex apologizes, Yuna admits she just wanted to feel remembered too. Two quiet days later, Mina remembers the ring when reaching out to Alex, Yuna's lonely message goes to Sam, the person Yuna feels closest to, and Haru, who only knows Alex, writes to Alex again.",
  "world": {
    "people": {
      "alex": "Alex",
      "sam": "Sam"
    },
    "characters": [
      {
        "id": "mina",
        "name": "Mina",
        "profile": "Warm and expressive.",
        "traits": [
          "warm"
        ]
      },
      {
        "id": "yuna",
        "name": "Yuna",
        "profile": "Sensitive and observant.",
        "traits": [
          "sensitive"
        ],
        "state": {
          "loneliness": 30
        }
      },
      {
        "id": "haru",
        "name": "Haru",
        "profile": "Calm and playful.",
        "traits": [
          "calm",
          "playful"
        ]
      }
    ],
    "relationships": [
      {
        "from": "yuna",
        "to": "alex",
        "affinity": 40,
        "trust": 20
      },
      {
        "from": "yuna",
        "to": "sam",
        "affinity": 55,
        "trust": 35
      },
      {
        "from": "yuna",
        "to": "haru",
        "affinity": 25,
        "trust": 40
      },
      {
        "from": "haru",
        "to": "yuna",
        "affinity": 28,
        "trust": 35
      },
      {
        "from": "haru",
        "to": "alex",
        "affinity": 25
      },
      {
        "from": "mina",
        "to": "alex",
        "affinity": 30
      },
      {
        "from": "mina",
        "to": "sam",
        "affinity": 20
      }
    ]
  },
  "events": [
    {
      "type": "gift_received",
      "from": "alex",
      "to": "mina",
      "item": "ring",
      "observed_by": [
        "yuna"
      ],
      "at": "monday"
    },
    {
      "type": "time_tick",
      "now": "monday evening",
      "hours": 3
    },
    {
      "type": "apology_offered",
      "from": "alex",
      "to": "yuna",
      "reason": "I should have brought something for you too.",
      "at": "tuesday"
    },
    {
      "type": "time_tick",
      "now": "thursday",
      "hours": 48
    }
  ],
  "expect": [
    {
      "output": "proactive_message",
      "character": "yuna",
      "reason": "jealous",
      "to": "alex",
      "count": 1
    },
    {
      "output": "proactive_message",
      "character": "haru",
      "reason": "curious",
      "to": "alex",
      "count": 1
    },
    {
      "output": "proactive_message",
      "character": "yuna",
      "reason": "lonely",
      "to": "sam",
      "count": 1
    },
    {
      "output": "proactive_message",
      "character": "mina",
      "reason": "lonely",
      "to": "alex",
      "text": "I still have the ring you gave me. Do you have a minute to talk?",
      "count": 1
    },
    {
      "output": "proactive_message",
      "character": "haru",
      "count": 2
    },
    {
      "output": "proactive_message",
      "to": "user",
      "count": 0
    }
  ]
}
