{
  "$schema": "../scenario.schema.json",
  "name": "Company",
  "description": "The user goes quiet for four days. Haru, who looks out for Yuna, keeps inviting Yuna to spend the afternoon; Yuna likes Haru but not yet enough to ask first, and once, between afternoons, she writes to the user instead. Three afternoons together bring her close enough that on the fourth day she is the one who asks. Mina has no friend that close: she ends up the loneliest, reaches out to the user, and when nobody answers waits three days before trying again.",
  "world": "demo",
  "events": [
    {
      "type": "time_tick",
      "now": "day1 12:00",
      "hours": 12
    },
    {
      "type": "time_tick",
      "now": "day2 00:00",
      "hours": 12
    },
    {
      "type": "time_tick",
      "now": "day2 12:00",
      "hours": 12
    },
    {
      "type": "time_tick",
      "now": "day3 00:00",
      "hours": 12
    },
    {
      "type": "time_tick",
      "now": "day3 12:00",
      "hours": 12
    },
    {
      "type": "time_tick",
      "now": "day4 00:00",
      "hours": 12
    },
    {
      "type": "time_tick",
      "now": "day4 12:00",
      "hours": 12
    },
    {
      "type": "time_tick",
      "now": "day5 00:00",
      "hours": 12
    }
  ],
  "expect": [
    {
      "output": "character_interaction",
      "kind": "together",
      "to": "yuna",
      "count": 3,
      "character": "haru"
    },
    {
      "output": "character_interaction",
      "character": "yuna",
      "kind": "together",
      "to": "haru",
      "count": 1
    },
    {
      "output": "proactive_message",
      "character": "yuna",
      "reason": "lonely",
      "count": 1
    },
    {
      "output": "proactive_message",
      "character": "mina",
      "reason": "lonely",
      "count": 2
    },
    {
      "character": "mina",
      "field": "loneliness",
      "at_least": 80
    },
    {
      "character": "yuna",
      "field": "loneliness",
      "at_most": 60
    },
    {
      "character": "haru",
      "field": "loneliness",
      "at_most": 40
    },
    {
      "relationship": [
        "yuna",
        "haru"
      ],
      "field": "affinity",
      "equals": 33
    },
    {
      "memory": {
        "character": "yuna",
        "kind": "experienced",
        "content": "yuna spent time with haru."
      },
      "count": 4
    }
  ]
}
